"Problem","Severity","File","Line","Column","Rule","Description","URL","Category","Engine"
"1","3","/Users/rsoesemann/dev/aquivalabs/app-setup/force-app/main/default/components/setupStep.component","50","73","VfUnescapeEl","Avoid unescaped user controlled content in EL","https://docs.pmd-code.org/pmd-doc-7.5.0/pmd_rules_visualforce_security.html#vfunescapeel","Security","pmd"
"2","3","/Users/rsoesemann/dev/aquivalabs/app-setup/force-app/main/default/classes/SetupStep.cls","106","5","ApexSharingViolations","Apex classes should declare a sharing model if DML or SOQL/SOSL is used","https://docs.pmd-code.org/pmd-doc-7.5.0/pmd_rules_apex_security.html#apexsharingviolations","Security","pmd"
"3","3","/Users/rsoesemann/dev/aquivalabs/app-setup/force-app/main/default/classes/SetupStep.cls","138","20","ApexCRUDViolation","Validate CRUD permission before SOQL/DML operation or enforce user mode","https://docs.pmd-code.org/pmd-doc-7.5.0/pmd_rules_apex_security.html#apexcrudviolation","Security","pmd"
"4","3","/Users/rsoesemann/dev/aquivalabs/app-setup/force-app/main/default/classes/SetupUsingBatch.cls","9","24","ApexCRUDViolation","Validate CRUD permission before SOQL/DML operation or enforce user mode","https://docs.pmd-code.org/pmd-doc-7.5.0/pmd_rules_apex_security.html#apexcrudviolation","Security","pmd"
"5","3","/Users/rsoesemann/dev/aquivalabs/app-setup/force-app/main/default/classes/SetupUsingBatch.cls","20","10","ApexCRUDViolation","Validate CRUD permission before SOQL/DML operation or enforce user mode","https://docs.pmd-code.org/pmd-doc-7.5.0/pmd_rules_apex_security.html#apexcrudviolation","Security","pmd"
